{
  "schema_version": "0.2",
  "review_id": "DU-PCA-004-XENON-INDEPENDENT-REMAP-V0.2",
  "artifact_type": "PHENOMENON_CAPABILITY_ATLAS_INDEPENDENT_REMAP",
  "status": "COMPLETED_NONROUTING_INDEPENDENT_REMAP_WITH_PRIOR_EXPOSURE",
  "owner": "dynamic-unity",
  "routing": {
    "non_routing": true,
    "banked": false,
    "wip": false,
    "live_authority": "CURRENT-RESEARCH.yaml",
    "executable_continuation": null
  },
  "card_ref": "DU-PCA-004",
  "source_freeze": {
    "binding_id": "SRC-DU-XENON",
    "source_owner": "dynamic-unity",
    "immutable_revision": "0f09474855a97c7961470a10e8ecda1a65baa4e1",
    "artifact_locator": "explorations/dual-phase-xenon-prompt-delayed-event-pairing-and-accidental-coincidence-boundary-2026-07-30.md",
    "assertion_selector": "sections 2-8",
    "content_sha256": "b2de002412780eb6a5ff08cf68e7648e949acd753de1d5dcf3d7186a11cb5d7d"
  },
  "method": {
    "ordering": "SOURCE_FIRST_THEN_FIELD_COMPARISON",
    "prior_atlas_exposure": true,
    "blinded": false,
    "reviewer_relation": "INDEPENDENT_OF_V02_CARD_AUTHORING",
    "comparison_unit_policy": "The source-first reconstruction and its 39 comparison units were frozen before authoring the additive v0.2 card. Each unit receives exactly one unweighted verdict: agreement when HC-DU-183 explicitly supports or entails the published field, disagreement when the source-first object or type differs, and underdetermined when the source does not select or establish the field. Prior exposure to v0.1 is recorded and can bias agreement upward."
  },
  "review_axes": {
    "mapping": {
      "status": "COMPLETED_WITH_FRAME_DEPENDENCE",
      "evidence_refs": [
        "lab/phenomenon-capability-atlas/atlas-v0.1.json#/phenomena/3",
        "lab/phenomenon-capability-atlas/cards-v0.2/du-xenon-s1-s2.json",
        "the 39 field_comparisons in this artifact"
      ],
      "limitations": [
        "The reviewer had prior exposure to the v0.1 atlas, so this is source-first ordered but not blinded.",
        "The comparison measures one analyst remap, not inter-rater reliability."
      ]
    },
    "source": {
      "status": "SELECTOR_AND_DIGEST_REVIEWED",
      "evidence_refs": [
        "SRC-DU-XENON at revision 0f09474855a97c7961470a10e8ecda1a65baa4e1",
        "tests/du_dual_phase_s1_s2_pairing_probe.py",
        "tests/artifacts/du_dual_phase_s1_s2_pairing_result.json"
      ],
      "limitations": [
        "The collaboration papers were consumed through HC-DU-183's filed primary-source reconstruction rather than independently re-audited in this remap.",
        "The exact finite fixture proves factorization logic, not the empirical frequency of ambiguous packets."
      ]
    },
    "domain": {
      "status": "LOCAL_ACCEPTED_PHYSICS_PACKET_WITH_APPARATUS_GAP",
      "evidence_refs": [
        "HC-DU-183 sections 2, 4, 5, and 6",
        "HC-DU-183 source pins to XENON1T detector/DAQ, XENONnT triggerless reconstruction, and PandaX-II accidental-coincidence evidence"
      ],
      "limitations": [
        "No independent dual-phase-xenon domain expert participated.",
        "The packet is family-level and does not freeze one detector's numerical fields, thresholds, rates, calibration epoch, or event cuts."
      ]
    }
  },
  "source_first_reconstruction": {
    "phenomenon_regime": "Family-level dual-phase-xenon S1/S2 transduction and event association: accepted detector physics, triggerless retention, and accidental coincidences under parameterized above-threshold, calibration, drift-window, geometry, and event-class conditions. The packet composes evidence from multiple collaboration apparatuses and is not one numerically frozen experimental regime.",
    "physical_initial_conditions": [
      "A dual-phase liquid-gas xenon target supports prompt scintillation, electron drift, extraction, and gas electroluminescence.",
      "An admitted energy-deposition interaction occurs in the active liquid and can form excitation and ionization channels.",
      "Clock, drift velocity, sensor response, active-volume geometry, and acquisition thresholds are calibrated for the declared class.",
      "The event-building interval may contain multiple acquired S1 and S2 candidates.",
      "Detector-specific field strengths, thermodynamic state, electron lifetime, diffusion, thresholds, rates, calibration epoch, and cuts remain unfrozen."
    ],
    "process": [
      "The interaction forms prompt S1 and ionization electrons.",
      "Electrons drift, extract across the liquid-gas interface, and form delayed S2.",
      "Sensors and triggerless DAQ retain separate above-threshold endpoint records.",
      "Software later constructs target-blind compatibility edges and pairing estimates.",
      "A correct pair conditionally supports drift depth; S2 pattern supports transverse position; S2/S1 and multiplicity support statistical classification."
    ],
    "record_topology": [
      "The underlying interaction occurrence is distinct from S1 and S2 traces.",
      "S1 and S2 digitized peaks are distinct retained endpoint records.",
      "The common-occurrence relation between one S1 and one S2 is a separate relation record and is absent from an untagged ambiguous raw packet.",
      "An event-builder estimate is inferential and does not become physical provenance by algorithm alone.",
      "A retained physical common tag or source-justified unique matchability can conditionally certify the relation and pairing-dependent depth.",
      "One linear seven-stage ladder cannot preserve this branching endpoint-plus-relation topology without changing targets between stages."
    ],
    "observer_profiles": [
      "Analyst-selected DAQ archive profile: both unpartitioned endpoint streams and calibration context are visible; retention is possible but exact pairing is not.",
      "Analyst-selected calibrated event-builder profile: both streams, geometry, calibration, compatibility rules, stochastic model, and optional side information are visible; pairing can be inferred and conditionally certified.",
      "HC-DU-183 selects no observer, so neither profile is a source-owned canonical observer."
    ],
    "capability_tasks": [
      "Retain and query above-threshold S1 and S2 endpoint records.",
      "Determine whether event membership and paired depth are constant over every physically admissible matching of the raw packet.",
      "Conditionally reconstruct drift depth only after pairing is fixed.",
      "Estimate transverse position from S2 pattern and perform risk-bounded statistical response classification.",
      "Resources and risks include both streams, clock, drift and geometry calibration, thresholds, target-blind admissibility, optional physical tag, accidental coincidences, multiple matchings, calibration error, and overlapping response laws."
    ],
    "geometric_structures": [
      "Physical TPC active volume, drift direction, liquid-gas interface, and sensor-plane geometry.",
      "Bipartite compatibility graph on acquired S1 and S2 candidates with target-blind admissibility edges.",
      "Raw-packet fibres containing physical histories that share endpoint records but differ in common-occurrence relation and pairing-dependent targets.",
      "The source establishes a graph and matching set, not a separately axiomatized matching complex."
    ],
    "issuance_assessment": "UNDERDETERMINED_FROM_SOURCE: HC-DU-183 supplies no source-side issuance primitive or same-neighbor-data discriminator. Ordinary detector dynamics, acquisition, relation refinement, and delayed reconstruction are sufficient absorbers; no issuance classification is earned by the source remap.",
    "finality_assessment": "UNDERDETERMINED_AT_PUBLIC_AND_GLOBAL_SCOPE: a raw immutable packet does not settle event membership when multiple admissible matchings remain. Target-local settlement is conditional on a physical tag or unique matchability, but HC-DU-183 does not run the full local/public/global finality triple gate."
  },
  "field_comparisons": [
    {"comparison_id": "M1", "category": "METADATA", "published_field": "/display_name", "verdict": "AGREEMENT", "source_first_finding": "The name correctly identifies dual-phase-xenon S1/S2 formation and pairing."},
    {"comparison_id": "M2", "category": "METADATA", "published_field": "/domain", "verdict": "AGREEMENT", "source_first_finding": "Particle detection and event building are the source-owned domain."},
    {"comparison_id": "M3", "category": "METADATA", "published_field": "/source_binding_refs", "verdict": "AGREEMENT", "source_first_finding": "SRC-DU-XENON is the correct immutable HC-DU-183 binding."},
    {"comparison_id": "M4", "category": "METADATA", "published_field": "/source_grounding_status", "verdict": "AGREEMENT", "source_first_finding": "The local packet contains a primary-source detector audit and exact finite pairing control, without transferring its Grade 4 result to the atlas."},

    {"comparison_id": "P1", "category": "PHYSICS", "published_field": "/physics/empirical_signature", "verdict": "AGREEMENT", "source_first_finding": "S1/S2 formation, conditional depth, and accidental pairing are source-supported."},
    {"comparison_id": "P2", "category": "PHYSICS", "published_field": "/physics/accepted_frameworks", "verdict": "AGREEMENT", "source_first_finding": "The named detector, drift, acquisition, and event-building frameworks match HC-DU-183."},
    {"comparison_id": "P3", "category": "PHYSICS", "published_field": "/physics/governing_relations", "verdict": "AGREEMENT", "source_first_finding": "Prompt formation, delayed drift response, paired-depth relation, and compatibility matching are source-supported."},